New South Wales,Dr Luke Parry,"This project aims to reconstruct the early evolutionary history of the Spiralia, a megadiverse animal group that extends back 540 million years. Their oldest fossils represent some of the earliest known animals and can reveal much about the speed and magnitude of evolution during the Cambrian Explosion, when most animal groups rapidly appeared. This project expects to generate new knowledge on the origin and radiation of some of the first animal body plans to better understand the early history of complex life. Anticipated outcomes and benefits include a new macroevolutionary framework for spiralians, novel approaches to studying invertebrate fossils, and highlighting the scientific importance of Australia’s natural heritage.",The University of New England,"$399,064 ",3
New South Wales,Dr Michelle Peterie,"This project will investigate the consequences of parental detention for children living in the Australian community. It will use qualitative sociological methods to document and theorise children’s experiences of a parent’s detention, with a focus on the factors that shape children’s social, emotional and material wellbeing in these situations. Expected outcomes include new knowledge concerning the lives and welfare of these potentially vulnerable children, as well as evidence-based insights regarding the social supports they need to thrive. The project will deliver internationally relevant recommendations to help policymakers and service providers improve the lives of children and families navigating the incarceration of a parent.",The University of Sydney,"$459,242 ",3
New South Wales,Dr Yi Shen,"It has been recognized recently that cellular proteins can undergo liquid-liquid phase separation, however, a further liquid-to-solid transition can lead to aberrant biological processes. This project aims to investigate and control this behaviour to gain insights into cell dysfunction and new routes for biomaterials development. An integrated approach combining microfluidic platforms, optical techniques, and vibrational spectroscopy will be exploited. Expected outcomes of this project include the mechanistic understanding of protein phase behaviour and protein-based biomaterial engineering. This should provide significant benefits in the prevention of aberrant protein aggregation and the generation of materials as plastic substitutes.",The University of Sydney,"$441,454 ",3
New South Wales,Dr Brigitte Sommer,"This project aims to unravel the causes of abrupt ecological change in the subtropics and predict their future in warming seas. Uniting large-scale field observation and modelling in a novel multi-species framework, this project seeks to quantify how warming and species interactions combine to escalate change on subtropical reefs at different stages of tropicalisation. Expected outcomes include new insights into the factors that promote stability or change along subtropical coasts in Australia and Japan, where the influx of tropical species already has dramatic consequences. By comparing dynamics in Australia with tropicalisation hotspots in Japan, this project expects to anticipate future ecological shifts and benefit strategic management.",University of Technology Sydney,"$444,300 ",3
New South Wales,Dr Elyse Stanes,"The circular economy is being promoted to resolve the looming materials crises created by excessive consumption. But circularity is still out of reach for much of the economy. The DECRA project aims to address critical questions of how to manage obdurate wastes that exceed circular economy models. Through an innovative critical social science approach, the project expects to advance knowledge on two stubbornly obdurate wastes – refrigerants and plastic textiles, their latent capacities for circularity, and the policy framings required to achieve change. Expected outcomes include enhancing Australia’s capacity in developing more circular economies, and integrating these into the next generation of industry and environmental policies.",University of Wollongong,"$449,335 ",3
New South Wales,Dr Kaiwen Sun,"This project aims to develop Kesterite/Si tandem device for photoelectrochemical carbon dioxide reduction to produce solar fuels. It is expected to reveal the photoelectrochemical mechanism of the p-n heterojunction, thereby promoting solar energy utilisation and greenhouse gas reduction. Expected outcomes include delivery of a high-performance kesterite photocathode for efficient CO2 reduction, a kesterite/Si tandem device for overall unassisted solar fuel production, and an in-depth understanding of structure-performance correlation to guide future heterojunction photocathode design. This project should provide significant benefits in minimising fossil fuel consumption, increasing energy security, and expanding the clean energy industry.",The University of New South Wales,"$440,154 ",3
New South Wales,Dr Jemma Todd,"This project aims to determine how pain interpretation drives pain experience, using rigorous state-of-the-art lab research. This project expects to generate new knowledge about the psychological mechanisms maintaining pain experience and avoidance behaviour, using novel techniques to measure interpretation of pain sensations. Expected outcomes include the development of an evidence-based psychological model of pain interpretation, enhanced capacity to build international collaborations, and ecologically valid methods for measuring pain interpretation. This research forms a solid platform for further translational research, to build novel, scalable interventions to improve outcomes for the one in five Australians living with chronic pain.",The University of Sydney,"$423,154 ",3
New South Wales,Dr Wei Wang,"This project aims to solve the problem of fire hazards caused by static electricity in hazardous industrial areas by synthesizing feasible, environmentally friendly, and efficient multifunctional biomass-based coatings. This research expects to study the fire-safe biomass coating using interdisciplinary approaches and establish a comprehensive understanding to provide new strategies and solutions to tackle fire safety issues occurring in hazardous industries and other relevant applications. This research and development of high value-added high-tech multifunctional biomass coating is targeted to boost the Australian local coating industry and bring about important economic and societal benefits.",The University of New South Wales,"$436,554 ",3
New South Wales,Dr Thomas White,"This project seeks to reveal how dynamic colour signals enable effective communication by connecting the production, transmission, and perception of visual information through space and time. By integrating innovative analyses of behaviour, physiology, and optics, it will offer original insight into how information is encoded and fluidly exchanged under real-world conditions, and produce new tools for interrogating the subjective visual world of animals. This work promises benefits to our understanding of how the universal process of communication drives adaptation amidst environmental change, with significant scope for bio-inspired solutions to contemporary problems of vision and efficient information processing, including among humans.",The University of Sydney,"$411,567 ",3
New South Wales,Dr Felicity Wilcox,"This DECRA will investigate one of Australia’s significant art-forms: opera. Led by an established Australian composer, it aims to develop new technologies and methods for composition and collaboration. The expected outcomes include new analysis of contemporary, international operatic practice and an original Australian opera that focuses on gender equity in music as its subject, translating data on this topic into creative-practice. The DECRA's significance is to create new, more inclusive frameworks for opera that centre women and gender-diverse music creators and can extend to other musical genres. Benefits include the investigation of urgent issues arising now in Australian workplaces and amplification of the voices of the marginalised.",University of Technology Sydney,"$457,350 ",3
New South Wales,Dr Daozhi Xu,"This project will produce the first major study of Chinese Australian writing about Indigenous people, culture and country from the 19th century to the present. Drawing on literary, historical, and cultural studies approaches, it will provide insights into the enduring Indigenous-Chinese relationships from Chinese perspectives. It will bring to light how Chinese immigrants engage with Indigenous issues to articulate a sense of belonging. It will provide a new account of the making of Chinese Australian identity, by exploring a distinctly Chinese position between Indigenous and settler sovereignties. It will enhance understanding of the role and responsibility that Chinese Australians have towards national reconciliation.",Macquarie University,"$371,402 ",3
New South Wales,Dr Xin Yu,"The aim of this project is to provide new effective and generalisable deepfake detection methods for automatically detecting maliciously manipulated visual data generated by misused artificial intelligence (AI) techniques. It will present innovative computer vision and image processing knowledge and techniques, enabling the developed methods to advance human perception in recognising fake data, enhance cybersecurity, and protect privacy in AI applications. The anticipated outcomes should provide significant benefits to a wide range of applications, such as providing timely alerts to the media, government organisations, and the industry about misleading fake visual data, and preventing financial crimes on synthetic identity fraud.",University of Technology Sydney,"$421,554 ",3
New South Wales,Dr Meng Zhang,"This project aims to improve the intrinsic stability of metal halide perovskite energy materials for advanced optoelectronic applications. The key concept is to suppress the phase-segregation for alloyed perovskite by interstitial management as well as develop low-temperature crystallization for non-alloyed perovskite through rational design of the intermediate phase evolution, which has the potential to generate new knowledge in addressing the key challenge on the operational stability of perovskite devices. The outcomes are expected to deliver valuable intellectual property to accelerate the commercialization of perovskite technology, enabling low-cost utilization of solar energy for a sustainable and low carbon-emission economy.",The University of New South Wales,"$426,780 ",3
New South Wales,Dr Zhongpu Zhang,"Despite its importance and potential, ceramic additive manufacturing (AM) is facing significant challenge for its inherent material characteristics prone to shrinkage and fracture during fabrication process. This project aims to fill a knowledge gap by developing a new computational design framework for a commonly-used indirect AM process. It will address a range of AM issues, such as residual stress/distortion, cracks, and uncertainty in a nondeterministic context. The study is expected to establish novel design methodologies for ceramic AM with process modelling, robust/reliable optimisation, and fracture-based design. It will provide ceramic industry with a new framework for biomedical, aerospace and mechanical applications.",The University of Sydney,"$448,354 ",3
New South Wales,Dr Shan Zhou,"This project addresses the need for corporate disclosures on climate-related risks. It aims to generate new knowledge about reporting and auditing of climate-related information and how these metrics are incorporated into executives’ remuneration. Utilizing the latest global developments, the project will highlight best practices under both voluntary and mandatory reporting regimes and provide cross-jurisdictional evidence on the impact of mandatory reporting schemes. It will also test the effectiveness of reporting, auditing and remuneration in achieving carbon emissions reductions and meeting capital market demands. The project will lead to improved capital market efficiency and informed policy making in Australia and internationally.",The University of Sydney,"$434,287 ",3
Queensland,Dr Rebecca Byrne,"This project aims to be the first study to investigate whether children who experience consistent and responsive feeding practices both at home and in early childhood education and care have higher levels of self-regulation, optimal eating behaviour and diet quality. The project expects to develop simple and low-cost strategies that parents and educators can use at mealtimes to enhance child self-regulation. With one million Australian children in care during their parent’s working week, outcomes of this project have widespread benefits. Higher self-regulation improves a child's health and well-being and provides short- and long-term social and economic benefits including school readiness, academic achievement and workforce participation.",Queensland University of Technology,"$450,556 ",3
Queensland,Dr Seth Cheetham,"Each cell of the human body contains identical genetic information that is activated in different ways to form varied cell types. This research aims to develop novel single-cell genomic technologies to explain the origins of different cell types. This project expects to discover the molecular mechanisms through which specialised cell types are formed, which has been difficult to decipher using existing methods. My novel approach will elucidate how a small population of seemingly homogenous cells can give rise to a myriad of types of cells. Tracing the life histories of cells across time should lead to broad applications including in developmental biology, neuroscience and immunology.",The University of Queensland,"$465,803 ",3
Queensland,Dr Tong Chen,"This project aims to address the resource-intensive and non-resilient nature of existing cloud-based personalised recommendation services. This project expects to generate new knowledge in the intersection of on-device machine learning and recommender systems. The expected outcomes include a novel auto-deployment platform that can efficiently customise a model for each user device's configuration, supporting on-device recommendation and model updates with tiny computational footprints. The benefits of these outcomes will position Australia at the forefront of AI and give numerous businesses the tools needed to deploy innovative business systems with a secure and cost-effective advantage.",The University of Queensland,"$420,154 ",3
Queensland,Dr Peng Chen,"This project aims to design functional materials for the development high-performance and durable solar energy conversion devices, which enable efficient green solar hydrogen production to reduce fossil fuel consumption and alleviate environmental burden. The expected outcomes include advanced semiconducting materials, proof-of-concept solar-driven water electrolytic system with a high solar-to-hydrogen conversion efficiency, and cutting-edge knowledge in material science, physical chemistry, and nanotechnology. The success of this project expects to facilitate pilot-scale green hydrogen industry and thus position Australia at the frontier of advanced materials, clean energy, and renewable hydrogen supply technologies.",The University of Queensland,"$394,818 ",3
Queensland,Dr Daicong Da,"Fracture is the main source of material failure and may cause serious engineering disasters and even death. This project aims to develop a Data-Driven Design System that intelligently optimizes local materials and architectures for heterogeneous structures with desired fracture response, and enhancing their mechanical fracture properties including stiffness, strength, toughness, and failure displacement. It will open up a new and promising research field in mechanics and data-driven science that deals with intractable inverse problems in broad engineering fields. Economic, high-performance, and customized 3D printed structural materials will be generated to benefit national corporations and enterprises and meet the high-end industry needs.",Queensland University of Technology,"$439,012 ",3
Queensland,Dr Itia Favre-Bulle,"Understanding the functions and intricacies of the brain is a fundamental challenge in scientific research. This project aims to develop new technologies to construct a microscope able to alter and make sense of neuronal activity in situ. This project also aims to investigate the precise role of a key brain region involved in sensory processing: the locus coeruleus. The results will reveal how this brain region influences brain dynamics as well as behaviour. Expected outcomes include state of the art microscopes, high impact publications, and international collaborations. The anticipated benefits are the high quality training of the Australian workforce and further establishment of Australia as a leader in microscopy and neuroscience.",The University of Queensland,"$382,462 ",3
Queensland,Dr Fiona Foley,This project aims to unite conflicting versions of Australian history by investigating the impact and effectiveness of Australian Aboriginal Frontier War memorials. It will expand our understanding of the shared sacrifices by First Nation and settler Australians during the frontier war and demonstrate the reconciliatory potential of memorialising art informed by Indigenous oral history and creative arts research and practice. The social and cultural benefits include developing a new understanding of the historical construction of Australian national identity and the potential of Indigenous art to transform the function of Australian military monuments as well as a permanent archive of short documentary films and publication.,Griffith University,"$454,705 ",3
Queensland,Dr Lachlan Harris,"Most adult stem cells in our brains are sleeping (quiescent). Quiescence helps ensure animals have a lifelong population of brain stem cells, which is crucial for the maintenance of brain circuitry. This project aims to investigate how this process is regulated at a molecular level. This project expects to define the molecular playbook controlling quiescence and explain why brain stem cells progress into deeper states of quiescence during aging by combining novel tissue culture and genetic models, where brain stem cells have disrupted quiescence, with innovative methods of reading gene expression. The benefits of these outcomes include the development of methods to control the quiescence of brain stem cells for bioengineering purposes.",The University of Queensland,"$444,576 ",3
Queensland,Dr Jessica Harrison,"Mosquito-borne viruses are a topic of intense research due to their complex biology, ecology and evolution, and their potential to produce unpredictable outbreaks of disease in both humans and animals. Insect-specific viruses (ISVs) are viruses that replicate solely in mosquito cell and are unable to infect vertebrate tissues. This project aims to assess the biodiversity of ISVs in the Australian mosquito population and identify key factors behind their restriction in vertebrates. The objectives of the studies proposed will answer clearly defined important biological questions about ISVs, while also delivering technological advances, novel reagents and potential commercial outcomes for the control and prevention of arboviral disease.",The University of Queensland,"$397,003 ",3
Queensland,Dr Siqi Huo,"This project will create a new class of phosphorus/imidazole oligomers for single-component epoxy resins with superior storage stability, fire retardancy and mechanical properties. By establishing a fundamental understanding of the structure-composition-property relationships of one-component epoxy resins, it will address two major challenges - high reactivity and short shelf life, and poor flame retardancy and mechanical properties, which limit practical applications. This project will develop environmentally benign, flame-retardant oligomers, reducing fire hazards, protecting lives, property and the environment, by replacing current flammable epoxy resins used in electrical, construction and transportation.",University of Southern Queensland,"$421,574 ",3
Queensland,Dr Hope Johnson,"Australia needs to produce more protein, sustainably into the future. This project aims to determine how this can be achieved by developing optimal ways of regulating alternative proteins. Alternative proteins imitate meat and dairy but are often made using new technologies. This project combines an innovative mix of empirical and legal analysis to understand the full range of expectations, opportunities and risks regarding alternative proteins and their regulation. It uses this new knowledge to determine how to regulate for healthy, sustainable and prosperous future food systems. Expected outcomes include a new approach to regulating food and the creation of new pathways for stakeholder engagement in regulation for better food futures.",Queensland University of Technology,"$450,853 ",3
Queensland,Dr Jacqueline Lau,"This project aims to understand how morality influences adaptation to climate change in the Great Barrier Reef region. This project expects to generate new knowledge in the critical area of climate change adaptation, using an interdisciplinary approach. Expected outcomes include empirical insights into the connection between morality and adaptation, international collaborations, theory development, and refined methods to help identify leverage points for incorporating morality into climate change decision-making. This should provide significant benefits, including a basis for policy-making in Australia and globally, that supports effective and just adaptation to climate change in ways that sustain livelihoods and respect local values.",James Cook University,"$439,218 ",3
Queensland,Dr Andrew Letten,"The flow of nutrients through ecological systems fluctuates through time and yet the impact this variability has on the maintenance of biodiversity is poorly understood. Drawing on emerging theory and a tight integration of modelling and experiments in a model microbial system, this project aims to investigate the impact of modified nutrient regimes on the structure and stability of ecological communities. This project expects to generate new knowledge at the forefront of research into diversity maintenance, ecosystem functioning and higher-order interactions. The outcomes should provide a deep mechanistic understanding of microbial community dynamics, with applications from animal health to environmental flows and insect pest management.",The University of Queensland,"$447,320 ",3
Queensland,Dr Rijia Lin,"This project aims to develop a new class of glassy metal-organic framework (MOF) membranes for CO2 separation and conversion. By constructing membrane reactors, it is expected to simultaneously separate CO2 from gas mixture and subsequently convert it into value-added chemicals in a continuous single operating unit. The expected outcomes include fabrication techniques for ultrathin MOF glass membranes, cutting-edge knowledge in advanced MOF membrane design, a new generation of MOF devices, and efficient membrane reactors for CO2 conversion with mixed gas feed. This project expects to accelerate the development of low-carbon technologies and provide significant benefits in mitigating the adverse effects of anthropogenic CO2 emissions.",The University of Queensland,"$437,154 ",3
Queensland,Dr Haijiao Lu,"This project aims to use solar energy to convert carbon dioxide, the primary greenhouse gas that drives global climate change, into valuable chemicals via catalytic reduction. This project expects to facilitate the selective production of valuable ethylene from carbon dioxide reduction by developing novel cocatalyst materials derived from metal-oxo cluster molecules. Expected outcomes include fundamental understanding of the structure-property relationship in new catalytic systems, and technological breakthroughs in reducing carbon dioxide emissions. The success of this project will bring significant environmental and economic benefits, and position Australia at the frontier of global transition to a low-carbon economy.",The University of Queensland,"$409,118 ",3
Queensland,Dr Ariadna Matamoros Fernandez,"Harmful humour impacts on women’s wellbeing online, but is poorly managed by social media platforms, and has not been integrated into online safety regulation and policy. This project aims to bring together sociocultural theory, social media analysis, and interviews to better understand the dynamics of harmful humour online in Australia. It will work with users, community leaders and industry stakeholders to evaluate current platform and policy responses and how they could be improved. The anticipated outcomes include theoretical advances, workable principles for better content moderation processes that reduce harm without restricting healthy expression, and evidence-based contributions to debates on online safety regulation.",Queensland University of Technology,"$400,000 ",3
