Victoria,Dr Katie Auchettl,"This project aims to understand the unexplored population of non-active or quiescent supermassive black holes (SMBHs) using tidal disruption events - the multi-wavelength outburst resulting from a star being ripped apart by the tidal forces of the SMBH. This project will increase our understanding of the transient and accretion properties of SMBHs in a broad range of galaxies, while the expected outcomes include novel techniques for distinguishing different types of extreme SMBH emission and characterisation of the environments where these extreme transient events occur. These outcomes will facilitate the identification of transient SMBH events and enhance the scientific return of the next generation of international optical surveys.",The University of Melbourne,"$433,219 ",3
Victoria,Dr Sean Bay,"The aim of this project is to unveil the microbial biodiversity, novel metabolic capabilities and chemosynthetic primary production of subsurface ecosystems, such as those found in caves. Leveraging a powerful blend of geospatial, molecular and biogeochemical approaches this project expects to identify the microbial basis of subsurface biogeochemical processes driving the earth’s major elementary cycles. Expected outcomes include a predictive framework to assess and upscale the impact of these microbial communities on the environment. Benefits include predicting and responding to climate risks, such as the desertification of agricultural soils, by uncovering how microorganisms respond to nutrient and carbon depletion.",Monash University,"$418,893 ",3
Victoria,Dr Marcus Baynes-Rock,"This research aims to produce knowledge of the ways in which humans and animals co-construct landscapes via the medium of cultural burning. It will be the first multispecies ethnography of people and animals on Native Title land engaged in landscape modification based on the use of cultural fire. Taking its lead from Indigenous partners this research will develop narratives of how humans, and animals co-construct landscapes via the medium of fire within wider socio-ecological frameworks. These narratives will inform policy and practice with regard to forest management, protection of species, conservation management, bushfire mitigation, promotion of biodiversity, and Indigenous health.",Deakin University,"$420,000 ",3
Victoria,Dr Annisa Beta,"Employing youth participatory action research in Indonesia, this project investigates the digital tools, resources, and strategies used by female youth to advocate for social change. The existing strategies used by development organisations rely on traditional, top-down advocacy approaches, overlooking the innovative ways girls and young women in developing countries use digital technologies to teach one another about gender-based violence and empowerment. Expected outcomes include youth-centred digital strategies and publicly accessible resources. The project's findings will be used to improve the design of gender empowerment programs that can be scaled up to enhance the Australian government’s aid distribution.",The University of Melbourne,"$432,854 ",3
Victoria,Dr Andreas Boes,"This project aims to create a photonic chip technology that generates hundreds of coherent laser lines in the visible spectrum from a single chip for accurate sensing, imaging unknown objects and measuring gas emissions. The project expects to introduce this new capability in the current photonic chip technology, which currently only operates with infrared light. The expected outcomes are inexpensive, stable and energy-efficient devices the size of a fingernail that will enable measurements with unprecedented accuracies. This should allow these devices to be mounted on drones, satellites, and robots, making them attractive for defence, information security, imaging, autonomous vehicle, and sensing applications.",RMIT University,"$456,354 ",3
Victoria,Dr Renata Borovica-Gajic,"This project aims to develop a next-generation database platform for seamless data exploration, where users can interactively search for insights buried in the data, without a clear outcome in mind. Unlike today's database management systems, this platform does not require costly experts to tune the database for fast responses, and guides users towards finding insights. Using the latest advancements in machine learning to facilitate data exploration and reduce the time and effort to discover insights, this open-source database platform should provide significant benefits to Australian businesses and boost scientific discovery, increasing Australia’s competitiveness in the global data-driven market.",The University of Melbourne,"$428,000 ",3
Victoria,Dr David Broadway,"This project aims to use innovative quantum sensing technologies to investigate the novel emerging field of two-dimensional magnetism; imaging both static and dynamic forms of 2D magnetism. This project expects to generate new knowledge about magnetic van der Waals materials and their potential application to ultra-thin electronic and spintronic devices. Expected outcomes of this project are a deeper understanding of the formation and modulation of magnetic order in 2D, new fabrication methods for deliberate domain wall formation, production of near-zero energy gap spin-waves, and new encapsulation methods for ultra-stable 2D materials. This should provide significant benefits towards fundamental physics and future device engineering.",RMIT University,"$458,318 ",3
Victoria,Dr Ashleigh Butler,"This project aims to explore the inclusion experience of siblings during a significant family crisis – a child’s critical illness. Exclusion from a family crisis can have lasting impacts, however sibling experiences of inclusion when a child is critically ill remain unstudied. Through observation and interviews with children and their families, this project expects to generate new knowledge about sibling inclusion in this family crisis. Expected outcomes include guidelines to enhance sibling inclusion and a resource to support family togetherness. This project should provide significant social benefits, such as changes to local and national sibling and family policies, and improved family wellbeing for all Australian families in crisis.",La Trobe University,"$375,000 ",3
Victoria,Dr Earvin Cabalquinto,"This project aims to investigate the experiences of ageing migrants in accessing and using digital communication technologies in their personal home settings. Taking the case of elderly Filipino-Australians, and deploying multi-sited ethnography and visual methods, this project expects to generate new knowledge on the consequences of digital divide on their personal and social wellbeing. Expected outcomes include culturally appropriate recommendations and resource materials to determine and reduce communication barriers for ageing migrants, migrant communities, policy makers, and relevant stakeholders. This should provide significant benefits in enhancing ageing migrants’ connective capacities to navigate a secure digital landscape.",Deakin University,"$408,106 ",3
Victoria,Dr Qiran Cai,"This project aims to investigate the thermal transport mechanism of strained two-dimensional materials for self-cooling thermal management. It expects to generate new knowledge about their unique thermal properties, guiding the use of waste heat generated in electronics for self-cooling. Expected outcomes include a novel energy-effective thermal management strategy and enhanced capacity to engineer thermal transport in two-dimensional materials that will be deployed in miniaturised and high-density electronics to overcome overheating problems. This will provide significant benefits to the economy and the environment, such as reduced cost, energy consumption and CO2 emissions in thermal management technologies.",Deakin University,"$459,592 ",3
Victoria,Dr Leon Chan,"This project aims to uncover the relationship between roughness topography and drag by utilising high-performance and efficient hardware acceleration. This project expects to generate new knowledge in the area of rough-wall turbulent boundary layer by using state-of-the-art hardware accelerated high fidelity simulations and machine learning techniques to identify important roughness parameters. Expected outcomes of this project include the development of a novel, more accurate, and robust model to predict drag. This would lead to improved data-driven policies for more sustainable and profitable airline and maritime industries.",The University of Melbourne,"$426,154 ",3
Victoria,Dr Taissa Danilovich,"Almost everything around us is made up of elements that were created inside stars. This project aims to understand the origin of the elements by studying newly created material ejected by Sun-like stars during one of the final stages of their lives. This project expects to generate new knowledge in the field of stellar evolution by using state-of-the-art telescopes to measure the elements and isotopes produced by these stars and comparing them with theoretical model predictions. Expected outcomes include a better understanding of element creation, the chemical enrichment of galaxies, and the first mass estimates for intermediate-mass stars. This should provide significant benefits by addressing a key outstanding question in astronomy.",Monash University,"$377,429 ",3
Victoria,Dr Kate Dooley,"National pledges to tackle climate change rely heavily on land to sequester and store carbon. How competing ideas about land use are negotiated and institutionalised in the climate regime is critical to effective, just and legitimate climate responses. This project aims to explain the political economy of the science and policy of land-based climate mitigation, generating new knowledge on who promotes carbon sinks and why. The expected project outcomes include guidelines to advance more just and sustainable land use through improved carbon accounting practices, using an innovative approach that combines stakeholder interviews, discourse analysis, and expert elicitation. These outcomes will notably benefit rural communities and farmers.",The University of Melbourne,"$429,744 ",3
Victoria,Dr Brendan Dyett,"This project aims to determine how nanoscale objects which mimic the surface of cells behave in biologically relevant environments. This project expects to generate new knowledge in physical chemistry by complementing innovative surface chemistry design and characterisation with data science approaches. The expected outcome of this project is identification of the mode of interaction of these biomimetic objects with cells, which may then reveal a new pathway for the delivery of pharmaceuticals. This could provide significant future benefits in the treatment of neurological diseases and bacterial infections, by overcoming the barrier that the cell surface presents to the uptake of many medicinal drugs.",RMIT University,"$438,026 ",3
Victoria,Dr Maximilien Evrard,"Tissue-resident memory T cells (TRM) are key for immune protection against infection and cancer at barrier sites including the gut. Whilst much of our understanding of gut TRM comes from studies on the small intestine, how these cells develop and function in the large intestine is unknown. Using state-of-the-art techniques and novel animal models, this project aims to (i) identify molecular pathways by which the local intestinal microenvironment influences TRM development and (ii) how these pathways could modulate TRM generation specifically in the small or large intestine. The expected outcomes are to generate fundamental new knowledge that will have significance for regulation of the immune response.",The University of Melbourne,"$471,754 ",3
Victoria,Dr Nicholas Ferns,This project aims to provide the first detailed history of the relationship between Australia and the World Bank. Engagement with international organisations is a central feature of Australian foreign relations. The project expects to provide new knowledge on the connections between development and decolonisation that dictated post-war global politics. Expected outcomes of this project include an enhanced understanding of the international significance of Australia’s post-war development and the complex process of Papua New Guinea’s decolonisation. This should provide benefits to Australia and the field through a better understanding of how to navigate an increasingly complex international political and economic environment.,Monash University,"$436,759 ",3
Victoria,Dr Lea Frermann,"This project aims to develop tools to detect biased narratives and one-sided framing in news stories using novel natural language processing methods to understand the text more deeply. Unlike existing methods, which overly rely on surface word co-occurrences patterns, the novel methods will be able to capture narratives in a more holistic and intuitive manner. Expected outcomes include new modeling techniques grounded in theory and a tool to highlight biases with recommendations for diverse sets of news articles. By raising awareness to biased news reporting, the project will benefit Australians through more balanced public discourse on global challenges, such as climate change and health pandemics.",The University of Melbourne,"$430,504 ",3
Victoria,Dr Victoria Garside,Malformations in the developing heart can lead to catastrophic defects and embryonic loss. The valves play a critical role in blood flow regulation and are made of a stratified matrix that is laid down early in development. This project aims to determine how the cellular fate of the early valve cells establish the layered matrix and in turn how the matrix can influence cell fate by utilising a multi-omics approach to identify unique cell populations and integrate transcriptional and protein changes during matrix disruption. This project expects to generate fundamental knowledge on how matrix structure can influence cell fate in the valves and will advance Australia's knowledge base and research capabilities in developmental biology.,The University of Melbourne,"$461,154 ",3
Victoria,Dr Chamila Gunasekara,"This project aims to investigate a novel solution incorporating upcycled textile waste to reduce shrinkage induced cracking in reinforced concrete. The project is expected to generate new knowledge in crack nucleation and healing mechanisms in concrete and the application of flexible textile fibre reinforcement to control shrinkage induced cracking, creating a new fibre reinforced composite. The expected outcome is a reduction in construction waste through extending the life span of concrete structures and reducing textile waste, 85% of which is currently disposed in landfills. The new composite could deliver a circular solution to textile waste leading to significant social, environmental and economic benefits.",RMIT University,"$431,154 ",3
Victoria,Dr Lucas Hackl,"The project aims to utilise results from differential geometry and related areas to investigate the physics of interacting many-body quantum systems. This project expects to generate new knowledge in the area of mathematical physics with broad applications in quantum information, condensed matter physics and statistical mechanics. The key focus will lie on the development of variational methods for the efficient simulation of quantum evolution and the characterisation of suitable quantum state families by their correlation structures.",The University of Melbourne,"$425,100 ",3
Victoria,Dr Meiling Han,"This project aims to elucidate the fundamental mechanism of lipid remodelling in Gram-negative outer membrane, which is critical both in preventing noxious compounds and evading host immune defence. For the first time, the complex interplays between bacterial cellular metabolism and membrane remodelling will be defined through systems pharmacology, and the precise membrane-peptide interaction will be examined by computational and biophysical approaches. Novel knowledge will be generated to improve our understanding on how bacteria remodel their outer membrane in response to environmental stress. This will benefit the future design of much-needed antimicrobial strategies including products and technologies to target bacterial membrane.",Monash University,"$450,241 ",3
Victoria,Dr Briony Hill,"This project aims to reframe our understanding of women’s preconception lifestyle health using a novel, socioecological approach. This project expects to generate new knowledge on societal views of weight stigma for preconception women and identify policy stakeholders’ views on integrating preconception into healthy lifestyle policies. Expected outcomes of this project include a new theory- and evidence-informed conceptual model for preconception lifestyle health that transcends the current focus on personal responsibility. This should provide significant benefits, such as informing policy to drive systems changes around preconception lifestyle health with concomitant cultural benefits to Australians, leading to improved population health.",Monash University,"$426,816 ",3
Victoria,Dr Scarlett Howard,"This project aims to investigate changes to native bee cognition, morphology, and pollination capability in response to climatic warming. Using emerging experimental methods for behavioural testing and state-of-the-art 3D modelling of museum specimens, the project expects to identify which species are likely to experience change under future climate scenarios. This project expects to determine if increased temperatures cause pollination deficits through impaired bee cognition and changed morphology. The knowledge gained in this project will allow us to identify vulnerable species and develop strategies across agriculture, government, and community sectors to support pollination and inform conservation priorities.",Monash University,"$423,206 ",3
Victoria,Dr Yi Ju,"This project aims to improve the biological applications of nanomaterials by understanding their fundamental interactions with proteins and cells in relevant biological environments. This will create new knowledge on how humoral (antibody-mediated) immunity affects nanomaterials using cutting-edge immunoassays, bio–nano characterisation techniques, and bioinformatics. Expected outcomes of the project include an understanding of how specific antibodies modulate the protein coatings on nanomaterials, which will shed light on how immune cells interact with nanomaterials. This will lead to design principles for nanomaterial properties to improve their effectiveness in delivering drugs and gene therapies.",RMIT University,"$450,154 ",3
Victoria,Associate Professor Shiri Krebs,"This project aims to improve the legal regulation of predictive technologies for preventive counterterrorism measures. The project expects to generate new knowledge in counterterrorism law and policy using doctrinal, comparative, and empirical methods. In particular, the project collects data on the United Nations Security Council’s resolutions mandating collection, sharing, and use of predictive technologies to strengthen global counterterrorism, and examines how these resolutions influence security and human rights in Australia and its security partners. Expected outcomes include recommendations for improving the laws governing the use of predictive technologies and strengthening security, individuals’ human rights, and the rule of law.",Deakin University,"$446,593 ",3
Victoria,Dr Rachael Lappan,"This project aims to resolve the nature and basis of microbial life in the atmosphere, the largest but most unexplored potential ecosystem on Earth. The atmosphere plays a role in transporting microbes, but our understanding of resident atmospheric microbial communities and their role in global atmospheric processes is minimal. Using cutting-edge molecular and biogeochemical approaches, this project aims to identify true microbial residents of the atmosphere, understand their mechanisms for survival in this environment and explore their role in seeding newly formed environments. The anticipated outcomes include fundamental knowledge on atmospheric microbial ecosystems, and their influence on global atmospheric processes.",Monash University,"$454,741 ",3
Victoria,Dr Peng Li,"This project aims to develop electrolysis of amine captured carbon dioxide (CO2) technology to integrate CO2 capture and syngas production powered by renewable electricity. The aqueous amine captured CO2 will be directly electrolysed without CO2 desorption, compression, and purification, featuring extremely high efficiency and cost-effectiveness. Expected outcomes include the delivery of suitable amines, a family of chemically and structurally controlled electrocatalysts, an in-depth understanding of CO2 electrolysis mechanisms, and the demonstration of robust electrolyser prototypes. This project will provide significant benefits to Australia’s energy and environmental security, and boost its clean energy industry and economic growth.",Swinburne University of Technology,"$454,554 ",3
Victoria,Dr Quanxiang Li,"This project aims to develop innovative catalytic activation approaches for converting textiles waste to porous activated carbon fibre with potential application in energy storage and carbon capture. The project expects to address the key issue of textile upcycling and generate new knowledge in material science by revealing the principle of alkali metal-induced pore formation and carbon dot synthesis. Expected outcomes include advanced techniques to create value-added materials from recycling textiles waste and in-depth understanding of performance improvement mechanisms. Success will provide significant benefits in securing a sustainable future for Australia, ensuring valuable resources recovery and strategies for advanced manufacturing.",Deakin University,"$454,054 ",3
Victoria,Dr Paul-Antoine Libourel,"This project aims to investigate how sleep is affected by fear/stress by studying invasive and native rat species, historically exposed to different predation pressures. It expects to generate new knowledge in biological and health sciences, also helping controlling pests. This unprecedented approach to studying sleep will provide key insights on the environmental and genetic determinants of sleep, allowing us to better understand sleep, its expression and flexibility, and response to stress. More than providing fundamental answers on the evolution of sleep, this project will provide significant benefits such as new perspectives on invasive species management, and may also reveal new targets for treatments to stress related sleep disorders.",La Trobe University,"$426,598 ",3
Victoria,Dr Keng-Te Lin,"Environmental and industrial thermal management represents major global energy consumption and CO2 emission. This project aims to investigate a game-changing passive thermal management solution to tackle both heating and cooling problems without using any electricity. This is made possible by designing a nanostructured graphene metamaterial to either totally reject or totally absorb electromagnetic waves in certain spectral ranges. Expected outcomes include new design and fabrication strategies for novel photothermal films with high performance and cost-effectiveness. This is expected to lead to the development of novel energy efficient technologies for Australian industries, producing direct economic, social and environmental benefits.",RMIT University,"$450,554 ",3
Victoria,Dr Agathe Lisé-Pronovost,"This project aims to advance Australian geochronology and Earth magnetic field research by constructing high-quality paleomagnetic records from stalagmites and lake sediments. It is expected that this project will provide a new dating capacity in Australia for academia, cultural heritage and government in a region with rich Indigenous history. This should provide significant benefits advancing our understanding of Australia’s timeline and raising appreciation of the oldest continuous living culture in the world. The ancient geomagnetic field data will also be integrated into geomagnetic field models as part of the international effort understanding Earth’s magnetic field evolution and future impact on society.",The University of Melbourne,"$451,836 ",3
Victoria,Dr Ruben Loaiza-Maya,"State space models (SSMs) are popularly used to model economic variables such as inflation and financial volatility. Variational inference is a technique that allows for fast implementation of SSMs, but whose properties are yet to be understood. This project aims to study the properties of variational inference for SSMs used in economics. This research will develop new variational inference techniques to improve inferential and predictive accuracy from SSMs. An expected implication of this project is that it will expand the ability of economic institutions to employ larger SSMs, which will allow for more accurate models for economic variables. This will provide significant social benefits by leading to better informed economic policy.",Monash University,"$345,197 ",3
