Queensland,Dr Christopher Ndehedehe,"This project aims to develop a novel framework that uses big data from satellites to assess the impacts of droughts and water extraction on groundwater resources in Australia, currently poorly understood and difficult to monitor. This project expects to generate new insights into the mechanisms driving changes in groundwater availability and identify risks from sustained groundwater extraction. Expected outcomes include a new national capability to assess and monitor groundwater resources from space and providing data for government, farmers, communities and traditional owners to better prepare for future droughts, increase disaster preparedness, and sustainably manage groundwater resources in a changing climate.",Griffith University,"$428,000 ",3
Queensland,Dr Cheneal Puljevic,"As Australia implements policies that reduce the availability and affordability of tobacco, demand for illicit tobacco is likely to grow. This research aims to generate new knowledge about the drivers and deterrents of demand for illicit tobacco through three inter-related projects. Expected outcomes include a comprehensive understanding of factors influencing Australians’ demand for illicit tobacco, and expert-informed policy recommendations to reduce demand for and deter use of illicit tobacco. With no substantive Australian research on this topic for more than 15 years, this research will be essential to reduce the impacts of the illicit tobacco market, including substantial losses in tax revenue and the funding of organised crime.",The University of Queensland,"$458,039 ",3
Queensland,Dr Kate Quigley,"Oceans are changing. Coral reefs are wonders of high socio-economic value threatened by climate extremes. This project aims to identify reefs that support the most fundamental biological processes for ecosystem-scale resilience: dispersal, symbioses, and adaptation. To urgently prepare against extinction, this project expects to deliver ground-breaking estimates of coral evolution by integrating genomics and innovative disease models. Expected outcomes include the discovery of reefs that can survive extremes and repopulate other reefs, providing benefits in optimized capabilities to protect resilient and vulnerable reefs to sustain future ecosystem services and boosting Australia as a global leader in the conservation genomics revolution.",James Cook University,"$438,547 ",3
Queensland,Associate Professor Janice Rieger,"This project aims to respond to an identified injustice, as access to cultural heritage is still very limited for people with disability. Cultural tourism has one of the largest draws globally, but most cultural institutions are still not understanding equitable access to encourage inclusive cultural tourism and widen participation. As a world-first study this project will create an innovative co-design model of practice, through an ecological framework and inclusive multi-sensorial explorations that can be translated and adopted by national, state, university, and regional museums and galleries across Australia and globally. This timely project will benefit all Australians by co-designing greater access to our cultural heritage for all.",Queensland University of Technology,"$459,468 ",3
Queensland,Dr Jessica (Jessa) Rogers,"This project generates evidence that is urgently needed to improve Indigenous Australian boarding school outcomes, by examining the life paths and experiences of recent graduates. It draws on rich qualitative data regarding Indigenous graduate experiences, to examine practices that affect retention, attainment, post-school pathways and cultural wellbeing. This project expands a novel Indigenous research method, photoyarn, to amplify the voices of Indigenous participants using digital co-research processes. Providing first-hand evidence to inform Indigenous education policy, this project also produces best practice guidelines for Australia's boarding school industry, toward closing the gap in Indigenous boarding graduate outcomes.",Queensland University of Technology,"$436,968 ",3
Queensland,Dr Sally Staton,"Sleep in early childhood is the single most critical activity for healthy brain development. Yet, a third of young children are identified by their parents as having a sleep problem. This study aims to test the hypothesis that social mechanisms underpin developing sleep patterns and problems. The study examines the change in sleep patterns as children enter non-parental care and the daily and weekly regularity of sleep as they transition between home and their diverse care arrangements. Discovery of the ways family work lives influence child sleep presents the potential to offer new solutions to support healthy sleep development and avert sleep problems. The benefits are for caregivers, family well-being, and children’s development.",The University of Queensland,"$463,976 ",3
Queensland,Dr Julian Steele,"This project aims to develop deep structure-property relationships and strain engineering protocols to generate stable forms of the emerging inorganic halide perovskite semiconductors, which are promising for next-generation solar cells and light emitting diodes. This project expects to arrive at working light emitter and detector prototypes via a three-dimensional, multi-length scale strain engineering approach that utilises materials processing techniques already used in the semiconductor industry. The expected outcomes include the development of new stabilisation methods which are compatible with facile and scalable device processing, which will directly impact the success of future perovskite optoelectronic devices and technologies.",The University of Queensland,"$426,062 ",3
Queensland,Dr Elizabeth Strakosch,"This project aims to study the relationship between Indigenous policy systems and foundational political relationships in Australia, the US, Canada and New Zealand via in depth case studies. Across all four states, policy struggles to substantively improve Indigenous wellbeing, but Australia has the poorest results and weakest formal political recognition. Expected outcomes include a new approach to understanding Indigenous policy that links policy dynamics to conflicts between settler and Indigenous sovereignties and comparative policy data across the English Speaking settler colonial states. It will benefit Australian Indigenous and policy communities by showcasing international best practice in policy collaboration and effectiveness.",The University of Queensland,"$385,950 ",3
Queensland,Dr T.J. Thomson,"This project aims to measure the volume and quality of visual content on regional news platforms by diverse publishers in eight key geographic areas. It is the first in Australia to examine the full cycle from production through presentation to consumption for local visual news in a regional context. Expected project outcomes include enhanced relationships between journalists and communities, stronger regional news ecosystems, and a more representative local visual news product. These outcomes boost the academic understanding of an understudied area, help regional Australia, including regional Indigenous Australia, see itself in the journalism that is produced in the regions, and provide commercial benefits to hard-hit news providers.",Queensland University of Technology,"$454,386 ",3
Queensland,Dr Xianyu Wang,"This project aims to establish the first Australian indoor air monitoring program that identifies hazardous chemicals and their sources and trends under a changing climate. The project expects to provide key evidence to policy-making decisions including prioritising indoor chemical threats for regulation. The expected outcomes include the establishment of criteria for home recruitment for indoor pollution research, identification of new chemical pollutants and their sources, and assessment of their trends. The benefit is to advance the knowledge on indoor exposure research, raise the awareness of the climate change conditions, addressing the government priority research area of Environmental Change.",The University of Queensland,"$413,542 ",3
Queensland,Dr Penelope Williams,"This project aims to explain the impact of technologies that automate people management. Through four integrated studies, this project expects to generate new knowledge on a currently invisible set of managerial and industrial practices that are profoundly reshaping work and employment relations. Expected outcomes include the first typology of automated people management technologies that will be used to reveal where and how automated people management is occurring in Australia and its effects on managers and workers. This much needed research should provide significant practical benefit to organisations and inform emerging policy and frameworks for the responsible adoption of AI and digital technologies in Australian workplaces.",Queensland University of Technology,"$458,798 ",3
Queensland,Dr Miao Xu,"The project aims to develop data analytics techniques that aid better decision making in high-stake scenarios when data are less-trustable. While data-aided decision making has been widely used, less-trustable data may significantly distort the decisions made and hurt people impacted by these decisions. The outcome of this project expects to be a series of techniques covering data understanding and enhancement, model development and fitting, and novelty detection, to reduce the damage of less-trustable data. The research expects to benefit the people and companies impacted by data-aided decision making in cybersecurity, healthcare and financial fraud detection, providing risk-control services.",The University of Queensland,"$420,000 ",3
Queensland,Dr Zhe Yang,"The project aims to develop high-performance membranes with excellent permeability and selectivity to allow efficient separation processes with reduced energy consumption and products with high purities that cannot be achieved by conventional membranes. By introducing the functionalized interlayer, the novel membrane can achieve up to an order of magnitude higher solvent permeance with significantly enhanced solvent-solute selectivity. Machine learning algorithms will be applied to search for the ideal interlayer based on a newly-launched online and comprehensive database. This project will contribute to accelerating Australia’s progress towards net-zero carbon emission and allowing a sustainable environment.",The University of Queensland,"$429,554 ",3
Queensland,Dr Fan Zhang,"This project aims to quantify thermal environmental impacts on office productivity. It expects to firmly dismiss the prevailing misbelief that an indoor temperature of 22 °C leads to maximum workplace productivity, and create a paradigm shift in building management practice in commercial buildings. Expected outcomes of this project include a novel productivity metric, a standard measurement protocol for assessing thermal environmental impacts on office productivity, and world first indoor thermal environmental control guidelines tailored to diverse cognitive activities in the workplaces of different industries. This should provide cost-effective solutions to reduce building energy use while maintaining optimum workforce productivity.",Griffith University,"$435,232 ",3
Queensland,Dr Cheng Zhang,"This project aims to advance the development of safe rechargeable all-solid-state batteries (ASSBs) by innovating fluorinated block copolymers as solid-state electrolytes. ASSBs are the most promising power source for emerging energy storage goals, however, low ionic conductivity and poor long-term cycling stability are critical bottlenecks to their successful application. This project seeks to tackle these challenges by fabricating unique ionic conduction channels and stabilising electrode-electrolyte interfaces using fluorinated block copolymer electrolytes. The expected outcomes are new knowledge in polymer electrolytes and advancement in the commercialisation of ASSBs toward more efficient, safe and reliable energy storage technologies.",The University of Queensland,"$422,318 ",3
Queensland,Dr Dominique de Andrade,"Alcohol-related violence in entertainment precincts is a significant community safety problem. This project aims to improve knowledge on individuals that are violent in entertainment precincts. It is expected to be the first study globally to use linked data to develop multi-system informed offending trajectories of violent offenders in these settings, examine the impact of patrons bans on offending trajectories, and apply situational action theory to alcohol-related violence. Results are expected to inform a critical knowledge gap and assist in the development of targeted violence preventive responses which reduce harm and make communities safer.",Griffith University,"$442,723 ",3
South Australia,Dr Fatwa Adikusuma,This project will further develop a recent breakthrough in gene editing technology named CRISPR prime editing to improve its performance in generating specific genome modifications in cells and organisms. This project expects to generate new knowledge regarding optimal strategies for its deployment as well as create novel enhanced versions of the technology. This would significantly enhance our ability to perform precise genome modification of organisms and lead to substantial benefits for a vast array of applications in fundamental and applied biology. Future applications will include generating mutations in cells and model organisms for basic research and creating genetically enhanced agricultural animals or plants.,The University of Adelaide,"$458,238 ",3
South Australia,Dr Melanie Baak,"Schools are key sites to counter marginalisation and enable belonging. This study will investigate how Black African diaspora youth experience belonging in Australian schools and ways that schools can change practices to enhance belonging. The project will generate new knowledge of belonging and its importance for schooling using innovatory Participatory Action Research with African youth and teachers. Expected outcomes are directions for education policy and practices, development of professional resources for working with diasporic students and capacitating young African people as researchers. Anticipated benefits are improved school engagement, retention and outcomes for African diaspora youth and insights for other marginalised youth.",University of South Australia,"$464,162 ",3
South Australia,Dr Daniel Brown,This project aims to build upon Australia’s already pioneering research into the workings of the universe by addressing challenges facing future gravitational wave detectors. It will develop and utilise advanced new numerical models to generate new knowledge on large-scale precision interferometry and contribute towards the design of future detectors that are essential for gravitational wave astronomy to thrive. Expected outcomes are new optimised designs for detectors and an array of innovative new open-source numerical models for exploring new designs of quantum optics experiments. This will benefit both Australian and international research teams in the global effort to realise the third generation of gravitational wave detectors.,The University of Adelaide,"$368,818 ",3
South Australia,Dr Amanda Choo,"This project aims to address the need for a Queensland fruit fly male-only sterile release strain for the national Sterile Insect Technique program to control this devastating Australian horticulture pest. By combining two molecular technologies in a new strain that responds to temperature cues to trigger development of only male flies, this project expects to produce twice as many sterile males for release to mate with wild females in fruit fly outbreak areas, preventing production of the next generation. Expected outcomes include significant reduction in production costs and increased efficiency of the national sterile release program, facilitating control of this damaging pest to protect Australia's billion dollar horticultural industry.",The University of Adelaide,"$423,659 ",3
South Australia,Dr Dorothea Dumuid,"At every stage of life, how we use our time is one of the greatest determinants of our happiness, productivity, social wellbeing and quality of life. Time-use habits, for better or worse, are entrenched in daily routines that are difficult to break. This project aims to use existing population datasets to identify when during their life people are most likely to change their time-use habits, and to describe who may be at greatest risk of making unfavourable changes (e.g., replacing physical activity with sedentary time, not getting enough sleep). Expected outcomes include new analytical methods to understand time-use routines and new knowledge to inform future time-use improvement strategies to enable Australians to live their best life.",University of South Australia,"$443,154 ",3
South Australia,Dr Junnan Hao,"Aqueous Zn-ion batteries (ZIBs) are much safer and cheaper than current Li-ion batteries due to the water-based electrolyte and abundant Zn reserves. However, the state-of-the-art ZIB technique faces huge challenges for practical applications due to the low cathode capacity and poor Zn anode reversibility. This project aims to design novel cathodes with a new-type mechanism and highly reversible Zn anodes. Accordingly, on-demand large-size ZIBs and flexible devices under industrial parameters will also be developed. The success of this project will place Australia at the forefront of implementing safe and low-cost batteries in largescale smart grid systems, household markets, and wearable medical devices.",The University of Adelaide,"$456,318 ",3
South Australia,Dr Yun Liu,"This project aims to develop new platform technologies for making bio-inspired nanomaterials with tunable drug loading and controlled release. This project will revolutionise current approaches to make lipid nanoparticles camouflaged with natural cell membranes for delivery of both insoluble and soluble drugs. Significant outcomes will include a novel commercially relevant salt-induced nanoprecipitation platform technology for making precisely engineered nanomaterials with tailored functions for applications in controlled release and targeted delivery. Benefits include securing a sustainable future for Australia, with new nanotechnology strategies for advanced manufacturing.",The University of Adelaide,"$444,318 ",3
South Australia,Dr Andrew Merdith,"This project aims to establish the state and nature of the physical Earth systems (climate, topography, geography, erosion, carbon cycle, oxygen cycle) during the Neoproterozoic Era that made our planet habitable to complex life. By analysing these systems together, fundamental drivers and contributions to making a habitable planet will be untangled. Expected outcomes include the first ever series of climate models of this time period, as well a series of digital reconstructions of the physical systems themselves. Sedimentary hosted ore deposits, such as copper and cobalt, are formed partly as a function of erosion and climate, allowing us to provide a mechanistic driver to their formation, and consequently exploration.",The University of Adelaide,"$357,299 ",3
South Australia,Dr George Opie,"This project aims to identify changes in brain function that contribute to age-related reductions in movement control. By implementing a novel, multimodal approach involving cutting edge non-invasive brain stimulation, this project expects to identify the causal role of brain oscillations in the ability of older adults to learn new motor skills. Expected outcomes include a critical understanding of the basic neural mechanisms that contribute to altered motor function during healthy ageing. These outcomes will provide significant benefits, including important neurophysiological insight that is required to develop targeted interventions aimed at improving movement in older adults.",The University of Adelaide,"$435,298 ",3
South Australia,Dr Wenhao Ren,"This project aims to develop cooperative single-atom catalysts for efficient and selective electrocatalytic CO2 conversion and Zn-CO2 batteries. Cooperative catalysts at the single atom limit can potentially achieve enhanced electrochemical properties beyond state-of-the-art and will trigger significant theoretical and technological interests in energy conversion and storage fields. It is expected to generate new knowledge in materials science and electrochemistry, using interdisciplinary approaches of atom-precise material engineering, in situ characterisation and full-cell optimisation. Significant economic and environmental benefits are expected from developing carbon-neutral CO2 electrolysers with low cost and high energy efficiency.",The University of Adelaide,"$394,318 ",3
South Australia,Dr Pengtang Wang,"This project aims to develop a series of structure-tailored, activity-enhanced and selectivity-oriented heterogeneous molecular catalysts for efficiently converting carbon dioxide (CO2) into value-added fuels and chemicals. Innovations are expected in the rational design and engineering of materials, new mechanistic findings from computation and in-situ characterisation, and breakthroughs in CO2 conversion. Expected outcomes include new synthesis methods, innovative multi-structural engineering strategies, thorough reaction mechanism understanding, and high-performance commercially-relevant CO2 reduction electrolysis. Benefits include a sustainable future for Australia with decreased CO2 emissions and increased green-fuel production.",The University of Adelaide,"$431,318 ",3
South Australia,Dr Chao Ye,"Potassium-sulfur (K-S) batteries are recognised as a promising energy storage technology for large-scale applications, due to their high theoretical capacity, low toxicity and the low cost of both potassium and sulfur. However, their grid-scale development is plagued by safety hazards and fast capacity fade. This project aims to address these challenges by developing atomic-level engineering of host materials for sulfur, K metal anode and solid electrolyte. The outcomes of this project will provide increased understanding of the mechanism for K-S batteries and novel strategies for their development, placing Australia at the forefront of K-S batteries for scalable battery research and supporting our cutting-edge energy storage technology.",The University of Adelaide,"$420,818 ",3
Tasmania,Dr Lauren Roman,"The aim is to develop a novel epigenetic technique for the demographic assessment of long-lived seabirds, including albatrosses and petrels, for application to the conservation of 11 threatened species breeding across Australia. A major innovation will be an affordable and fieldwork-friendly technique to demographically fingerprint any population, ending the large amount of guesswork currently necessary in management. The outcome is expected to enable (i) scientists and wildlife managers to impute the impact of threats and management activities on seabird populations, allowing quantitative scenario modelling, and (ii) stakeholders to analyse numerous threats and optimise management responses to these through research-based decision-making.",University of Tasmania,"$426,216 ",3
Victoria,Dr Joel Anderson,"This project aims to conduct the first nation-wide investigation of internalised sexual prejudice – a key factor driving the health and well-being disparities experienced by same-sex attracted Australians. The project expects to generate new knowledge around the internalisation of past experiences of sexual prejudice. Expected outcomes include advanced measurement techniques of conscious and non-conscious prejudice, significant advances in understandings of the causes and consequences of internalised sexual prejudice, and an enhanced capacity for international collaborations. This should provide significant benefits for same-sex attracted Australians, and for the health, government, and community support sectors working with them.",La Trobe University,"$416,995 ",3
Victoria,Dr Aurina Arnatkeviciute,"The brain is a complex biological system that gives rise to our consciousness, thoughts, and experiences, yet we still do not know how this complexity emerges. This project aims to comprehensively investigate the genetics of brain connectivity combining cutting-edge techniques in neuroimaging, genomics, mathematical modelling, and cognitive neuroscience, focusing specifically on the connectivity of functionally important brain network hubs. The outcomes will provide a mechanistic understanding of the genetic origins of brain network formation and an explanation for how genetic influences on brain organisation shape human behaviour advancing the fundamental knowledge about the complexity of the brain.",Monash University,"$453,868 ",3
Victoria,Dr Sonja Arndt,"This project aims to raise early childhood teachers' cultural wellbeing and belonging, by strengthening anti-racist orientations and inclusion in their teaching teams. This project expects to generate new knowledge in this under-researched area, by using innovative, interdisciplinary approaches involving early childhood teachers in Brisbane, Sydney, Melbourne, and Auckland in sharing their culture stories in multimodal ways. Expected outcomes of the project include a guiding framework to enhance intercultural practices in early childhood settings, enhanced international collaborations, and significant benefits to the educational outcomes, cultural understandings and social wellbeing of Australia’s very young children.",The University of Melbourne,"$390,000 ",3
