State,Fellow,Project Summary,Administering Organisation,Total Project Funding,Project Duration in years
Australian Capital Territory,Dr Rebecca Colvin,"This project aims to discover the potential of social norms to enable energy-producing communities to explore and define a socially acceptable energy transition. By implementing and evaluating a new social norm change intervention in the Upper Hunter region, this project expects to generate new knowledge about what matters most to communities facing transition, and how norms, identities, and networks interact to enable or constrain change. Outcomes include direct input to energy transition planning, enhanced collaboration with policy and civil society, and new international research networks. This should provide significant benefits by helping Australian communities and policy-makers navigate the local impacts of global energy transition.",The Australian National University,"$454,532 ",3
Australian Capital Territory,Assistant Professor Kaitlin Cook,"This project aims to understand the process of energy dissipation in superheavy element fusion reactions. Using state-of-the art facilities unique to Australia, the first detailed measurements of the crucial early stages of these reactions will be made. This is expected to generate significant fundamental knowledge on why some superheavy element fusion reactions succeed, and why others fail. The outcomes are expected to significantly advance the fundamental understanding of nuclear reactions, and provide key guidance to international opportunities to create new superheavy elements and isotopes. Expected benefits include improving cancer treatments, understanding element abundance in the universe and improved safety in nuclear technologies.",The Australian National University,"$438,000 ",3
Australian Capital Territory,Dr Damien Esquerre,"This project aims to study how venom, nature's most powerful weapon, evolves and shapes biodiversity. Using the iconic Australian and New Guinean venomous snakes as a model, this project expects to develop a novel approach to profile venom composition from museum specimens, test competing hypotheses on the evolution of venoms, and test for the association between the evolution of venoms and the evolution of diversity in species richness and morphology. Expected outcomes include the largest venom database for any animal group and a better understanding of how venoms evolve and what role they play in earth’s biodiversity. The generated venom data has potential to be used in future studies to aid in the development of anti-venoms and drugs.",The Australian National University,"$387,373 ",3
Australian Capital Territory,Dr Elise Furlan,"This project aims to revolutionise conservation monitoring by developing environmental DNA tools to rapidly and efficiently extract detailed genetic data on entire populations from a simple environmental sample. This project expects to significantly enhance conservation management by providing critical information on genetic diversity and population health. Expected outcomes include new techniques to collect population genetic information with increased speed and affordability, enhancing the capacity for both industry and government to address conservation questions. This project is likely to provide significant benefits for aquatic conservation, where traditional monitoring proves problematic for many cryptic, elusive or rare species.",University of Canberra,"$438,909 ",3
Australian Capital Territory,Dr Gemma King,"This project aims to discover how contemporary screens represent deafness and how sign language cinema filters Deaf and non-ableist perspectives. Partnering with Deaf Connect and the National Film and Sound Archive, this project expects to provide a transnational, transdisciplinary framework for analysing Deaf language and culture on screen in terms of completeness and empowerment. Expected outcomes include capacity building for emerging Deaf scholars, inclusive innovations in film and language studies and new opportunities for Deaf/hearing dialogue and cohesion. This should lead to diverse benefits such as increased Deaf wellbeing and enhanced capacity to harness screen cultures to support and reflect the diversity of Deaf experience.",The Australian National University,"$465,100 ",3
Australian Capital Territory,Dr Mira Käkönen,"This project focusses on the challenge of repurposing large-scale hydraulic infrastructures to serve climate objectives, and aims to advance understanding of changing entanglements of rivers, infrastructure, and power relations in a time of climate change. It expects to contribute novel insights into water and climate change governance within and beyond the Mekong Region. Bridging political-ecology and infrastructure studies, planned outcomes include conceptual innovations that advance critical studies on river engineering. The project should benefit policy-makers, practitioners and advocacy groups in the Mekong and in Australia seeking to improve interventions and strengthen the coping strategies of vulnerable riverine communities.",The Australian National University,"$455,652 ",3
Australian Capital Territory,Associate Professor Aparna Lal,"This project seeks to strengthen our understanding of the role of environmental change in driving patterns of community risk, by building a spatially and temporally explicit model, and a risk index that will be designed with input from decision makers. This project expects to improve the implementation of geospatial tools for risk assessment using an innovative approach based on evidence and practice. Expected outcomes include increased and optimal implementation of geospatial data in Australian systems, and enhanced research capacity to proactively respond to environmental change.",The Australian National University,"$441,935 ",3
Australian Capital Territory,Dr Galina Levitina,"Estimates on eigenvalues of integral operators are at the core of numerous results in the study of quantum phenomena and in associated mathematical fields. This project aims to establish detailed spectral properties of the integral operators arising in quantum models incorporating magnetic fields. An anticipated goal is the generation of new and significant theoretical results in analysis that will open novel approaches to the use of magnetic differential operators. This is expected to benefit Australian science by invigorating collaboration between mathematics and theoretical physics, by providing research training relevant to emerging quantum science based technology and strengthening research collaborations with world leading scientists.",The Australian National University,"$432,000 ",3
Australian Capital Territory,Dr George Olah,"This project aims to analyse the illegal parrot trade by utilising conservation genomic approaches. The project will reveal wildlife trade routes in South-east Asia by developing cutting-edge forensic genomic techniques and criminological methods. Expected outcomes of this project include new field-deployable sequencing technology to provide in-situ genetic information for identifying the taxonomy and provenance of confiscated specimens, and a first ever genetic database of traded wildlife. The project will facilitate important countermeasures to the illegal wildlife trade including confiscation, reintroduction, improved law enforcement, and education for better biodiversity outcomes in our region.",The Australian National University,"$440,954 ",3
Australian Capital Territory,Dr Mitzy Pepper,"This project aims to locate hotspots of diversity in Australia’s vast, flat deserts and to quantify how well these areas are captured under the National Reserve System. I will establish a network of international and national collaborators and improve knowledge on how animals responded to past environmental change. The anticipated outcome of this project is to improve our ability to understand, measure and preserve our unique desert biodiversity and the evolutionary processes that sustain it, using our remarkably diverse reptile fauna as a model system. In the face of current, rapid environmental change, this has never been more important, and will provide a tool for biodiversity survival.",The Australian National University,"$432,469 ",3
Australian Capital Territory,Dr Thanh Son Pham,"This project aims to advance research on the internal structure and temporal change in the Antarctic ice sheet by analysing seismic ground motion records of natural sources, including ambient noise. This approach expects to complement existing satellite and airborne methods to resolve glacial structures over large areas and detect changes hidden under snow cover. The intended outcome is new knowledge of the ice sheet’s stratification, its long-term variation due to climate change, and its rapid response to local weather events. The benefits include improving the reliability of ice sheet evolution modelling and sea-level rise prediction, unlocking a polar gateway to study Earth deep interior, and preparing for space missions to icy worlds.",The Australian National University,"$425,143 ",3
Australian Capital Territory,Dr Prasanga Samarasinghe,"This project aims to research new 3D spatial audio processing techniques to analyse natural sounds for environmental conservation, while meeting the tasks, demands and data characteristics inherent to bioacoustics. Expected outcomes include new, accurate and efficient bioacoustics computation technologies, generalisable across different terrestrial regions, species types and environment changes. These could dramatically enhance the efficacy of current bioacoustic monitoring systems while opening up new research directions. Resulting technology could be adopted for immediate tasks like the monitoring of bushfire recovery efforts, and more generally, for the management and conservation of Australian natural resources.",The Australian National University,"$453,054 ",3
Australian Capital Territory,Dr Ying Xin Show,"This project aims to advance understanding of Cold War culture and decolonisation through Chinese diaspora experience and literature. By unearthing a corpus of underexplored archives, using literary analysis and ethnography, this interdisciplinary project offers the first comprehensive study of Sinophone literature and print culture in Cold War Malaya. Expected outcomes include new knowledge of how Chinese diaspora writers claim subjecthood amidst anti-communist violence in Southeast Asia, which shed light on the complex interplay of geopolitics, literature and identity. This project benefits Australian understanding of Chinese diaspora responses to global superpower rivalry during the ‘old’ Cold War amidst a similar phenomenon today.",The Australian National University,"$421,000 ",3
Australian Capital Territory,Dr Jonathan Zhu,"The proposed project aims to investigate theoretical properties of thin films and fluid interfaces, which are modelled as surfaces driven by surface tension, possibly in an enclosing container. This project is expected to generate new knowledge in the area of geometric partial differential equations, by utilising new techniques in geometric flows, and by establishing novel methods for boundary value problems. The developed techniques may have far-reaching applications in other areas of mathematical analysis, and the expected results would contribute greatly to the theory of surfaces governed by mean curvature, which arise in various real-world phenomena such as soap bubbles, black hole horizons and bushfire fronts.",The Australian National University,"$422,154 ",3
New South Wales,Dr Folarin Oluseye (Seye) Abimbola,"When the dignity of its beneficiaries is not respected, especially their dignity as knowers, global health efforts in low-income settings perpetuate falsehoods and promote wrong interventions. This project aims to fill an urgent gap in the field of global health – how to institutionalise respect for beneficiaries’ dignity as knowers. The project will do so by investigating strategies that helped to institutionalise evidence-based practices in the fields of health care and health policy. Expected outcomes include practical strategies to institutionalise dignity-based practices in knowledge production, use and circulation. This should lead to major social, health and economic benefits by improving the effectiveness of global health efforts.",The University of Sydney,"$443,742 ",3
New South Wales,Dr Ali Ahrari,"This project aims to address significant gaps in the existing knowledge about solving complex engineering problems that involve conflicting objectives and unquantifiable features. In these problems, the decision-maker is interested in knowing high-quality and dissimilar solutions that determine the trade-off between the problem objectives. The intended outcomes of this project include a novel robust computational solver that can automatically find such solutions. The decision-makers can then choose the final solution based on their expertise and preferences. This expects to offer significant benefits to diverse engineering disciplines by finding superior and more practical solutions to their complex multidisciplinary problems.",The University of New South Wales,"$329,278 ",3
New South Wales,Dr Scott Berry,"This project aims to reveal how human cells coordinate the kinetics of messenger RNA (mRNA) transcript production, processing and degradation at the single-cell level. It expects to generate significant new biological knowledge of gene regulation by combining innovative interdisciplinary research methodologies in genetics, single-molecule imaging, mathematical modelling and quantitative cell biology. Expected outcomes include enhanced training of researchers and to build Australia’s capability in the rapidly expanding fields of RNA biology and high-throughput microscopy. This should provide significant benefits for a myriad of applications including health, agriculture and veterinary sciences.",The University of New South Wales,"$463,618 ",3
New South Wales,Dr Emma Burns,"This project aims to determine how teacher-student relationships support adolescents’ motivation, engagement, and achievement in Mathematics, Science, and English via three hypothesised dimensions: socio-emotional support, instructional help, and conflict. This project expects to generate new knowledge about the impact of teacher-student relationships in each subject, over time, and if they can be improved by intervention. Expected outcomes include an online practice-driven toolkit and scalable intervention to enhance teacher capacity to build positive relationships. This knowledge will have significant benefits for students, teachers, and policy by identifying how to enhance the relationships most critical to adolescents’ academic success.",Macquarie University,"$410,723 ",3
New South Wales,Dr Orpheus Butler,"We need to know how different prescribed burning regimes set the stage for long-term changes in plant community composition, diversity, and flammability. This project aims to reveal how plant community dynamics under different fire scenarios can be predicted based on contemporary interactions between plants and soil micro-organisms. This innovative approach to fire ecology integrates soil biology and plant ecophysiology with sophisticated experiments and novel modelling techniques. Expected outcomes include a much-needed mechanistic framework for early detection of major ecological changes under novel fire regimes, with direct benefits for land managers and the long-term conservation of Australia’s iconic vegetation.",The University of Sydney,"$450,000 ",3
New South Wales,Dr Erin Campbell,"This project aims to deconstruct the brain circuits that shape reward-seeking behaviour in different environments. The anticipated significance of this project is to provide mechanistic insights into why we choose to seek rewards in safe, but not dangerous environments. Expected outcomes include answering fundamental questions about how the environment shapes our behaviour by identifying projection cell subtypes important for reward-seeking, characterising their neuronal activity and precisely defining their molecular phenotype. The benefits of this project are expected to provide a new knowledge base for understanding decision-making in a constantly changing world.",The University of Newcastle,"$393,903 ",3
New South Wales,Dr Clément Canonne,"This project aims to investigate the trade-offs between privacy, communication costs and accuracy of results when learning from users' sensitive data. The project intends to design faster and more accurate algorithms for a wide range of machine learning tasks by developing a novel and widely-applicable algorithmic framework. Expected outcomes of this project include new theoretical tools to guide the design of data-driven decision systems and rigorously analyse their performance and privacy guarantees. Privacy of individuals' information in data analytics pipelines is a key societal concern. This project should lead to significant benefits by strengthening privacy in these pipelines while also improving accuracy and cost-efficiency.",The University of Sydney,"$432,355 ",3
New South Wales,Dr Rosemary Cater,"There are more than 600 kilometres of blood vessels in the brain, all of which are lined by tightly packed cells that protect the brain from toxins. My research aims to investigate how these blood vessels are formed. This project expects to reveal the role that a critical signalling molecule called heme plays in this fundamental biological process. I will use cutting-edge structural biology and biophysical techniques to uncover the molecular mechanisms that allow heme to enter cells and regulate blood vessel growth in the brain. The outcomes of this research will enhance our understanding of the brain’s core infrastructure and will contribute to an understanding of how cerebral blood vessels grow and maintain integrity.",The University of Sydney,"$473,824 ",3
New South Wales,Dr Ben Chen,"Australians are witnessing the greatest intergenerational wealth transfer in history. Unfortunately, more and more families are going to court over inheritance. These disputes tear families apart and impose excessive costs on families and the courts. This project applies legal, behavioural economic and statistical methods to study inheritance battles. It seeks to generate new knowledge about the drivers of inheritance litigation, in order to make it cost-effective. Its expected outcomes include behavioural economic models of inheritance litigation to predict what cost-reduction strategies will work; a large database of real-world inheritance cases to test these predictions; and robust law-reform recommendations to reduce litigation costs.",The University of Sydney,"$445,880 ",3
New South Wales,Dr Shaopeng Chi,"Human bodies are densely covered with numerous mechanosensory neurons that provide us with the sense of touch and pain. However, the molecular force sensors remain poorly identified. This project aims at defining the fundamental roles of mechanosensitive ion channels to sense and respond to various mechanical stimuli, and how their responses may encode mechanical cues.The ultimate goal is to provide a fundamentally new understanding of proprioception and motion sensing. The new multimodality approach generated in this project is expected to evolve as a national facility for neuro-mechanobiology, and future research may lead to the inspiration of novel bionic sensor design and brain-computer interface for future neuroengineering industry.",The University of Sydney,"$444,154 ",3
New South Wales,Dr Leo Corcilius,"The project aims to develop a powerful new method for the generation of pure modified proteins. Tools for modification of proteins are integral to the study of protein structure and function as well as the commercial production of biopharmaceuticals. The extremely cost effective and operationally simple chemistry that will be developed in this project will overcome a number of pitfalls of currently available methods for protein modification, and will therefore deliver substantial technological innovation to both academia and industry. Through domestic and international collaboration, this new technology will be applied to study proteins involved in the defence of wheat against fungal rust disease and in inflammatory signalling in humans.",The University of Sydney,"$410,140 ",3
New South Wales,Dr Rahman Daiyan,"This DECRA aims to realise the direct electrochemical conversion of waste resources using renewable energy to generate urea at ambient conditions. By designing impurity-tolerant single atom catalysts and unearthing their structure-activity relationships, the utilisation of flue gas and wastewater will be materialised. This will advance our understanding in the field as current energy conversion reactions require pure feedstocks. Expected outcomes from the program is envisioned to lead to deployment of scalable decentralised modes of green urea production (substituting imports), and the knowledge transferrable to other areas of Australia’s emerging hydrogen economy, extending the scope of renewable Power-to-X to realise a circular economy.",The University of New South Wales,"$360,218 ",3
New South Wales,Dr Kit Double,The knowledge and skills developed in the classroom often do not transfer to the workplace or even to other subjects at school. This project aims to evaluate how the transfer of knowledge can be enhanced by prompting students to evaluate and reflect on their performance in specific ways. The project will identify how different students respond to self-evaluation and how self-evaluation can most effectively be designed and applied in the classroom. Newly developed self-evaluation prompts will be implemented in a computerised and adaptive way so that self-evaluation is tailored to a particular student. This project should provide a scalable and cost-effective way to help students apply what they learn in a more flexible and efficient way.,The University of Sydney,"$336,318 ",3
New South Wales,Dr Dorna Esrafilzadeh,"This project aims to fine-tune the interface of low-temperature liquid metals to produce functional hybrid nanomaterials for CO2 reduction. The expected outcomes of the projects are to develop fundamental knowledge on the integration of functional molecules on the bulk, core, and skin of liquid metals and their alloys. It intends to control the atomic arrangement of the elemental constituents, nucleation, as well as interaction and dissolution of organic/inorganic molecules in the interface and bulk of liquid metals. The anticipated outcomes of this project are to define a knowledge roadmap to exploit the untapped potentials of liquid metals in CO2 reduction, which would enable the production of the next generation of catalytic devices.",The University of New South Wales,"$434,395 ",3
New South Wales,Dr Anna Farmery,"The project aims to provide knowledge to improve food systems, in line with the UN Sustainable Development Goals, through fisheries and aquaculture. Food and health outcomes are not well-integrated into fisheries and aquaculture policy or management, despite global expectations that aquatic foods will help address current and anticipated food system challenges. Expected outcomes include new knowledge on implementing food- and nutrition-based management objectives in fisheries and aquaculture, and methods to measure benefits in different national contexts. Outcomes should increase capability to manage fisheries and aquaculture to improve human health through diets while achieving environmental, economic and other socially positive outcomes.",University of Wollongong,"$425,312 ",3
New South Wales,Dr Peyvand Firouzeh,"This project aims to investigate the historical movement of objects, knowledge, and people across cultures in the Indian Ocean world, countering the Eurocentric framework of previous scholarship by adopting a trans-Asian network lens. Focusing on art and architecture in fifteenth-century central India, it examines how an independent, largely Muslim state comprised of migrants fashioned itself through works of art that challenged cultural and geographical boundaries. This project expects to advance new methodologies for studying hybrid visual cultures, generate new knowledge about the dynamics of global connectedness in the early modern era, and deepen our understanding of the mechanics of migration and cultural exchange today.",The University of Sydney,"$458,318 ",3
New South Wales,Dr Hasindu Gamaarachchi,"This project aims to address limitations in nanopore sequencing (latest emerging technology in genomics) by applying advanced computational methods. This project expects to create new knowledge in bioinformatics and computer science through innovative approaches that leverage the live data streaming capability of nanopore devices to deliver results rapidly, or in real-time. Expected outcomes include improved, highly efficient analysis methods and designs for future creation of custom computer hardware for nanopore analysis. This will facilitate widespread adoption of nanopore technology in bioscience research and applied domains (health, agriculture, ecology, biosecurity and forensics), including for portable in-the-field applications.",The University of New South Wales,"$453,913 ",3
